ID,Title,URL,License
0,"Proces rozpoznania, oczekiwania oraz charakterystyka psychologiczna kobiet z zespołem wielotorbielowatych jajników",https://ppm.edu.pl/info/phd/GUM07de31bf6fcf4115b735f7b61bc121fa?aq=.%3Aca2a18e81f674e01a71e1adb8f31a7e8&r=phd&ps=100&tab=&title=Doktoraty%2B%25E2%2580%2593%2BProces%2Brozpoznania%252C%2Boczekiwania%2Boraz%2Bcharakterystyka%2Bpsychologiczna%2Bkobiet%2Bz%2Bzespo%25C5%2582em%2Bwielotorbielowatych%2Bjajnik%25C3%25B3w%2B%25E2%2580%2593%2BPolska%2BPlatforma%2BMedyczna&lang=pl,CC BY-SA
1,"Analiza zapisu elektroencefalograficznego, zmiennych neuropoznawczych, neurometabolicznych oraz wybranych zmiennych stanu psychicznego młodych dorosłych poddanych przezczaszkowej stymulacji prądem stałym-tdcs",https://ppm.edu.pl/info/phd/UML2768b0877d9e489281ef1a5c8c4156e2?aq=.%3Aca2a18e81f674e01a71e1adb8f31a7e8&r=phd&ps=100&tab=&title=Doktoraty%2B%25E2%2580%2593%2BAnaliza%2Bzapisu%2Belektroencefalograficznego%252C%2Bzmiennych%2Bneuropoznawczych%252C%2Bneurometabolicznych%2Boraz%2Bwybranych%2Bzmiennych%2Bstanu%2Bpsychicznego%2Bm%25C5%2582odych%2Bdoros%25C5%2582ych%2Bpoddanych%2Bprzezczaszkowej%2Bstymulacji%2Bpr%25C4%2585dem%2Bsta%25C5%2582ym-tdcs%2B%25E2%2580%2593%2BPolska%2BPlatforma%2BMedyczna&lang=pl,CC BY-SA
2,Sztywność i elastyczność aorty oceniane metodą wielorzędowej tomografii komputerowej jako potencjalne markery zdrowia i ryzyka sercowo-naczyniowego,https://ppm.edu.pl/info/phd/UMW182a04504a0b4be481fe2afa11ecd920?aq=.%3Aca2a18e81f674e01a71e1adb8f31a7e8&r=phd&ps=100&tab=&title=Doktoraty%2B%25E2%2580%2593%2BSztywno%25C5%259B%25C4%2587%2Bi%2Belastyczno%25C5%259B%25C4%2587%2Baorty%2Boceniane%2Bmetod%25C4%2585%2Bwielorz%25C4%2599dowej%2Btomografii%2Bkomputerowej%2Bjako%2Bpotencjalne%2Bmarkery%2Bzdrowia%2Bi%2Bryzyka%2Bsercowo-naczyniowego%2B%25E2%2580%2593%2BPolska%2BPlatforma%2BMedyczna&lang=pl,CC BY-SA
3,Ocena efektywności nowej metody rekonstrukcji kości żuchwy z wykorzystaniem indywidualizowanego 3D allogennego bloku kostnego w odcinkach uzębionych,https://ppm.edu.pl/info/phd/UMW3211444b64564887a08254b4ee9de5db?aq=.%3Aca2a18e81f674e01a71e1adb8f31a7e8&r=phd&ps=100&tab=&title=Doktoraty%2B%25E2%2580%2593%2BOcena%2Befektywno%25C5%259Bci%2Bnowej%2Bmetody%2Brekonstrukcji%2Bko%25C5%259Bci%2B%25C5%25BCuchwy%2Bz%2Bwykorzystaniem%2Bindywidualizowanego%2B3D%2Ballogennego%2Bbloku%2Bkostnego%2Bw%2Bodcinkach%2Buz%25C4%2599bionych%2B%25E2%2580%2593%2BPolska%2BPlatforma%2BMedyczna&lang=pl,CC BY-SA
4,"Ocena wpływu zmian systemowych na diagnostykę i leczenie pacjentów onkologicznych w Polsce. na przykładzie Uniwersyteckiego Szpitala Klinicznego im. Mikulicza Radeckiego we Wrocławiu, w latach 2010-2021",https://ppm.edu.pl/info/phd/UMWb99db56d323e4d32a4938445e531931f?aq=.%3Aca2a18e81f674e01a71e1adb8f31a7e8&r=phd&ps=100&tab=&title=Doktoraty%2B%25E2%2580%2593%2BOcena%2Bwp%25C5%2582ywu%2Bzmian%2Bsystemowych%2Bna%2Bdiagnostyk%25C4%2599%2Bi%2Bleczenie%2Bpacjent%25C3%25B3w%2Bonkologicznych%2Bw%2BPolsce.%2Bna%2Bprzyk%25C5%2582adzie%2BUniwersyteckiego%2BSzpitala%2BKlinicznego%2Bim.%2BMikulicza%2BRadeckiego%2Bwe%2BWroc%25C5%2582awiu%252C%2Bw%2Blatach%2B2010-2021%2B%25E2%2580%2593%2BPolska%2BPlatforma%2BMedyczna&lang=pl,CC BY-SA
5,Ocena bezpieczeństwa i skuteczności profilaktyki przeciwgrzybiczej pozakonazolem w oparciu o badania farmakokinetyki leku u dzieci poddanych intensywnej chemioterapii i/lub przeszczepieniu komórek hematopoetycznych,https://ppm.edu.pl/info/phd/UMW403d449a6fb64e0693bb2b038b35b803?aq=.%3Aca2a18e81f674e01a71e1adb8f31a7e8&r=phd&ps=100&tab=&title=Doktoraty%2B%25E2%2580%2593%2BOcena%2Bbezpiecze%25C5%2584stwa%2Bi%2Bskuteczno%25C5%259Bci%2Bprofilaktyki%2Bprzeciwgrzybiczej%2Bpozakonazolem%2Bw%2Boparciu%2Bo%2Bbadania%2Bfarmakokinetyki%2Bleku%2Bu%2Bdzieci%2Bpoddanych%2Bintensywnej%2Bchemioterapii%2Bi%2Blub%2Bprzeszczepieniu%2Bkom%25C3%25B3rek%2Bhematopoetycznych%2B%25E2%2580%2593%2BPolska%2BPlatforma%2BMedyczna&lang=pl,CC BY-SA
6,"Opracowanie profilu miRNA dla różnicowania, predykcji i rokowania zespołu kacheksji u chorych na przewlekłą niewydolność serca",https://ppm.edu.pl/info/phd/UML91b1aa9d784d4790a761120ae79bb61d?aq=.%3Aca2a18e81f674e01a71e1adb8f31a7e8&r=phd&ps=100&tab=&title=Doktoraty%2B%25E2%2580%2593%2BOpracowanie%2Bprofilu%2BmiRNA%2Bdla%2Br%25C3%25B3%25C5%25BCnicowania%252C%2Bpredykcji%2Bi%2Brokowania%2Bzespo%25C5%2582u%2Bkacheksji%2Bu%2Bchorych%2Bna%2Bprzewlek%25C5%2582%25C4%2585%2Bniewydolno%25C5%259B%25C4%2587%2Bserca%2B%25E2%2580%2593%2BPolska%2BPlatforma%2BMedyczna&lang=pl,CC BY-SA
7,Modyfikacja funkcji nerek przez suraminę w doświadczalnie wywołanej cukrzycy typu 1,https://ppm.edu.pl/info/phd/GUM059fd566c6454c0bb3b8282517d76d21?aq=.%3Aca2a18e81f674e01a71e1adb8f31a7e8&r=phd&ps=100&tab=&title=Doktoraty%2B%25E2%2580%2593%2BModyfikacja%2Bfunkcji%2Bnerek%2Bprzez%2Bsuramin%25C4%2599%2Bw%2Bdo%25C5%259Bwiadczalnie%2B%2Bwywo%25C5%2582anej%2Bcukrzycy%2Btypu%2B1%2B%25E2%2580%2593%2BPolska%2BPlatforma%2BMedyczna&lang=pl,CC BY-SA
8,Ocena zależności pomiędzy rekonstrukcją więzadła krzyżowego przedniego a rozwojem zmian zwyrodnieniowych stawu kolanowego,https://ppm.edu.pl/info/phd/UMWc9aedfae06b2478b9627bd435d73b812?aq=.%3Aca2a18e81f674e01a71e1adb8f31a7e8&r=phd&ps=100&tab=&title=Doktoraty%2B%25E2%2580%2593%2BOcena%2Bzale%25C5%25BCno%25C5%259Bci%2Bpomi%25C4%2599dzy%2Brekonstrukcj%25C4%2585%2Bwi%25C4%2599zad%25C5%2582a%2Bkrzy%25C5%25BCowego%2Bprzedniego%2Ba%2Brozwojem%2Bzmian%2Bzwyrodnieniowych%2Bstawu%2Bkolanowego%2B%25E2%2580%2593%2BPolska%2BPlatforma%2BMedyczna&lang=pl,CC BY-SA
9,Zmiany błony śluzowej jamy ustnej u dzieci leczonych onkologicznie z rozpoznaniem nowotworowych chorób hematologicznych,https://ppm.edu.pl/info/phd/GUM15b71336b6494d6bba9e39c2cfe50f29?aq=.%3Aca2a18e81f674e01a71e1adb8f31a7e8&r=phd&ps=100&tab=&title=Doktoraty%2B%25E2%2580%2593%2BZmiany%2Bb%25C5%2582ony%2B%25C5%259Bluzowej%2Bjamy%2Bustnej%2Bu%2Bdzieci%2Bleczonych%2Bonkologicznie%2Bz%2B%2Brozpoznaniem%2Bnowotworowych%2Bchor%25C3%25B3b%2Bhematologicznych%2B%25E2%2580%2593%2BPolska%2BPlatforma%2BMedyczna&lang=pl,CC BY-SA
10,"Ocena ekspresji kaspazy -3,-8-9 i surwiwiny oraz jej wpływ na czynniki kliniczno-patologiczne w raku żołądka i jelita grubego",https://ppm.edu.pl/info/phd/UMW2bf50c7ddc3042ffaabd4e192aa17ddd?aq=.%3Aca2a18e81f674e01a71e1adb8f31a7e8&r=phd&ps=100&tab=&title=Doktoraty%2B%25E2%2580%2593%2BOcena%2Bekspresji%2Bkaspazy%2B-3%252C-8-9%2Bi%2Bsurwiwiny%2Boraz%2Bjej%2Bwp%25C5%2582yw%2Bna%2Bczynniki%2Bkliniczno-patologiczne%2Bw%2Braku%2B%25C5%25BCo%25C5%2582%25C4%2585dka%2Bi%2Bjelita%2Bgrubego%2B%25E2%2580%2593%2BPolska%2BPlatforma%2BMedyczna&lang=pl,CC BY-SA
11,Ocena wpływu wybranych używek na nasilenie bruksizmu sennego oraz architekturę snu w badaniach polisomnograficznych,https://ppm.edu.pl/info/phd/UMW88f88380cec2400aad940ffe755eb9df?aq=.%3Aca2a18e81f674e01a71e1adb8f31a7e8&r=phd&ps=100&tab=&title=Doktoraty%2B%25E2%2580%2593%2BOcena%2Bwp%25C5%2582ywu%2Bwybranych%2Bu%25C5%25BCywek%2Bna%2Bnasilenie%2Bbruksizmu%2Bsennego%2Boraz%2Barchitektur%25C4%2599%2Bsnu%2Bw%2Bbadaniach%2Bpolisomnograficznych%2B%25E2%2580%2593%2BPolska%2BPlatforma%2BMedyczna&lang=pl,CC BY-SA
12,Analiza białek szlaku COX-2/PGE2 w raku jelita grubego,https://ppm.edu.pl/info/phd/UMW0e2cd790b41049a7a1851bc2de47009f?aq=.%3Aca2a18e81f674e01a71e1adb8f31a7e8&r=phd&ps=100&tab=&title=Doktoraty%2B%25E2%2580%2593%2BAnaliza%2Bbia%25C5%2582ek%2Bszlaku%2BCOX-2%2BPGE2%2Bw%2Braku%2Bjelita%2Bgrubego%2B%25E2%2580%2593%2BPolska%2BPlatforma%2BMedyczna&lang=pl,CC BY-SA
13,Czynniki prognostyczne śródczaszkowych powikłań krwotocznych w przebiegu leczenia antagonistami witaminy K i nowymi doustnymi antykoagulantami u chorych z migotaniem przedsionków,https://ppm.edu.pl/info/phd/UML53b9e9777f674af899a580e49fda47b9?aq=.%3Aca2a18e81f674e01a71e1adb8f31a7e8&r=phd&ps=100&tab=&title=Doktoraty%2B%25E2%2580%2593%2BCzynniki%2Bprognostyczne%2B%25C5%259Br%25C3%25B3dczaszkowych%2Bpowik%25C5%2582a%25C5%2584%2Bkrwotocznych%2Bw%2Bprzebiegu%2Bleczenia%2Bantagonistami%2Bwitaminy%2BK%2Bi%2Bnowymi%2Bdoustnymi%2Bantykoagulantami%2Bu%2Bchorych%2Bz%2Bmigotaniem%2Bprzedsionk%25C3%25B3w%2B%25E2%2580%2593%2BPolska%2BPlatforma%2BMedyczna&lang=pl,CC BY-SA
14,Ocena wartości klinicznej LncRNA dla predykcji i rokowania kacheksji chorych na przewlekłą niewydolność serca,https://ppm.edu.pl/info/phd/UML1664798d009b4a308bce8f660f41b592?aq=.%3Aca2a18e81f674e01a71e1adb8f31a7e8&r=phd&ps=100&tab=&title=Doktoraty%2B%25E2%2580%2593%2BOcena%2Bwarto%25C5%259Bci%2Bklinicznej%2BLncRNA%2Bdla%2Bpredykcji%2Bi%2Brokowania%2Bkacheksji%2Bchorych%2Bna%2Bprzewlek%25C5%2582%25C4%2585%2Bniewydolno%25C5%259B%25C4%2587%2Bserca%2B%25E2%2580%2593%2BPolska%2BPlatforma%2BMedyczna&lang=pl,CC BY-SA
15,Jakość opieki nad rodzicami ze zdiagnozowaną wadą letalną u płodu według modelu hospicjum perinatalnego,https://ppm.edu.pl/info/phd/UMWb66f710b854f4cd5bf077545a408e7bd?aq=.%3Aca2a18e81f674e01a71e1adb8f31a7e8&r=phd&ps=100&tab=&title=Doktoraty%2B%25E2%2580%2593%2BJako%25C5%259B%25C4%2587%2Bopieki%2Bnad%2Brodzicami%2Bze%2Bzdiagnozowan%25C4%2585%2Bwad%25C4%2585%2Bletaln%25C4%2585%2Bu%2Bp%25C5%2582odu%2Bwed%25C5%2582ug%2Bmodelu%2Bhospicjum%2Bperinatalnego%2B%25E2%2580%2593%2BPolska%2BPlatforma%2BMedyczna&lang=pl,CC BY-SA
16,"Ekspresja supresorowych antygenów BTLA, PD-1 i CTLA-4 w populacji efektorowych i regulatorowych limfocytów krwi obwodowej u chorych na szpiczaka plazmocytowego",https://ppm.edu.pl/info/phd/UMWdbfd3d59fedb45989c39b0c4d3993060?aq=.%3Aca2a18e81f674e01a71e1adb8f31a7e8&r=phd&ps=100&tab=&title=Doktoraty%2B%25E2%2580%2593%2BEkspresja%2Bsupresorowych%2Bantygen%25C3%25B3w%2BBTLA%252C%2BPD-1%2Bi%2BCTLA-4%2Bw%2Bpopulacji%2Befektorowych%2Bi%2Bregulatorowych%2Blimfocyt%25C3%25B3w%2Bkrwi%2Bobwodowej%2Bu%2Bchorych%2Bna%2Bszpiczaka%2Bplazmocytowego%2B%25E2%2580%2593%2BPolska%2BPlatforma%2BMedyczna&lang=pl,CC BY-SA
17,"Program Erasmus+ oraz pokrewne formy wymiany akademickiej jako składowe nowoczesnego kształcenia studentów w XXI w., ze szczególnym uwzględnieniem studentów kierunku fizjoterapia",https://ppm.edu.pl/info/phd/GUMd1608d75c2b7427d85463200faab4c82?aq=.%3Aca2a18e81f674e01a71e1adb8f31a7e8&r=phd&ps=100&tab=&title=Doktoraty%2B%25E2%2580%2593%2BProgram%2BErasmus%252B%2Boraz%2Bpokrewne%2Bformy%2Bwymiany%2B%2Bakademickiej%2Bjako%2Bsk%25C5%2582adowe%2Bnowoczesnego%2Bkszta%25C5%2582cenia%2B%2Bstudent%25C3%25B3w%2Bw%2BXXI%2Bw.%252C%2Bze%2Bszczeg%25C3%25B3lnym%2Buwzgl%25C4%2599dnieniem%2B%2Bstudent%25C3%25B3w%2Bkierunku%2Bfizjoterapia%2B%25E2%2580%2593%2BPolska%2BPlatforma%2BMedyczna&lang=pl,CC BY-SA
18,Poznawcze uwarunkowania efektywności wsparcia rehabilitacji kardiologicznej u pacjentów poddawanych pomostowaniu aortalno-wieńcowemu,https://ppm.edu.pl/info/phd/UMWa0071171a46d4d488c2ed219b05e9e9f?aq=.%3Aca2a18e81f674e01a71e1adb8f31a7e8&r=phd&ps=100&tab=&title=Doktoraty%2B%25E2%2580%2593%2BPoznawcze%2Buwarunkowania%2Befektywno%25C5%259Bci%2Bwsparcia%2Brehabilitacji%2Bkardiologicznej%2Bu%2Bpacjent%25C3%25B3w%2Bpoddawanych%2Bpomostowaniu%2Baortalno-wie%25C5%2584cowemu%2B%25E2%2580%2593%2BPolska%2BPlatforma%2BMedyczna&lang=pl,CC BY-SA
19,Ocena czynników wpływających na efektywność leczenia aparatami nakładkowymi,https://ppm.edu.pl/info/phd/UMW30eca98ec6594fe487bd4a50af83b13d?aq=.%3Aca2a18e81f674e01a71e1adb8f31a7e8&r=phd&ps=100&tab=&title=Doktoraty%2B%25E2%2580%2593%2BOcena%2Bczynnik%25C3%25B3w%2Bwp%25C5%2582ywaj%25C4%2585cych%2Bna%2Befektywno%25C5%259B%25C4%2587%2Bleczenia%2Baparatami%2Bnak%25C5%2582adkowymi%2B%25E2%2580%2593%2BPolska%2BPlatforma%2BMedyczna&lang=pl,CC BY-SA
20,Ekspresja wybranych cząstek mikro-RNA u pacjentów poddawanych chirurgicznej rewaskularyzacji naczyń wieńcowych z zastosowaniem różnych metod znieczulenia,https://ppm.edu.pl/info/phd/UMWa381efe2837e43d99ccbc5cda23bbe83?aq=.%3Aca2a18e81f674e01a71e1adb8f31a7e8&r=phd&ps=100&tab=&title=Doktoraty%2B%25E2%2580%2593%2BEkspresja%2Bwybranych%2Bcz%25C4%2585stek%2Bmikro-RNA%2Bu%2Bpacjent%25C3%25B3w%2Bpoddawanych%2Bchirurgicznej%2Brewaskularyzacji%2Bnaczy%25C5%2584%2Bwie%25C5%2584cowych%2Bz%2Bzastosowaniem%2Br%25C3%25B3%25C5%25BCnych%2Bmetod%2Bznieczulenia%2B%25E2%2580%2593%2BPolska%2BPlatforma%2BMedyczna&lang=pl,CC BY-SA
21,"Zespół metaboliczny, a aktywność reumatoidalnego zapalenia stawów oceniana parametrami klinicznymi, laboratoryjnymi i ultrasonograficznym",https://ppm.edu.pl/info/phd/UMLc01e424fcd6245e188927d57f6fe20a3?aq=.%3Aca2a18e81f674e01a71e1adb8f31a7e8&r=phd&ps=100&tab=&title=Doktoraty%2B%25E2%2580%2593%2BZesp%25C3%25B3%25C5%2582%2Bmetaboliczny%252C%2Ba%2Baktywno%25C5%259B%25C4%2587%2Breumatoidalnego%2Bzapalenia%2Bstaw%25C3%25B3w%2Boceniana%2Bparametrami%2Bklinicznymi%252C%2Blaboratoryjnymi%2Bi%2Bultrasonograficznym%2B%25E2%2580%2593%2BPolska%2BPlatforma%2BMedyczna&lang=pl,CC BY-SA
22,Porównanie cech warunkujących zasiedlanie i przeżycie bakterii z rodzaju Legionella izolowanych z ujęć szpitalnych i pozaszpitalnych,https://ppm.edu.pl/info/phd/UMW1913d1428bd446d7bd914de6c834b273?aq=.%3Aca2a18e81f674e01a71e1adb8f31a7e8&r=phd&ps=100&tab=&title=Doktoraty%2B%25E2%2580%2593%2BPor%25C3%25B3wnanie%2Bcech%2Bwarunkuj%25C4%2585cych%2Bzasiedlanie%2Bi%2Bprze%25C5%25BCycie%2Bbakterii%2Bz%2Brodzaju%2BLegionella%2Bizolowanych%2Bz%2Buj%25C4%2599%25C4%2587%2Bszpitalnych%2Bi%2Bpozaszpitalnych%2B%25E2%2580%2593%2BPolska%2BPlatforma%2BMedyczna&lang=pl,CC BY-SA
23,Wartość badania rezonansu magnetycznego w obrazowaniu przysadki u dzieci z zaburzeniami wzrostu lub dojrzewania płciowego,https://ppm.edu.pl/info/phd/UMWbbd58cd9be0546c1a91fd21c7da8027d?aq=.%3Aca2a18e81f674e01a71e1adb8f31a7e8&r=phd&ps=100&tab=&title=Doktoraty%2B%25E2%2580%2593%2BWarto%25C5%259B%25C4%2587%2Bbadania%2Brezonansu%2Bmagnetycznego%2Bw%2Bobrazowaniu%2Bprzysadki%2Bu%2Bdzieci%2Bz%2Bzaburzeniami%2Bwzrostu%2Blub%2Bdojrzewania%2Bp%25C5%2582ciowego%2B%25E2%2580%2593%2BPolska%2BPlatforma%2BMedyczna&lang=pl,CC BY-SA
24,Wewnątrznaczyniowe leczenie zwężeń i niedrożności żył centralnych w klatce piersiowej z zastosowaniem stentów żylnych u pacjentów hemodializowanych,https://ppm.edu.pl/info/phd/UML68aa56cf37e1492287c8c12c2d005d38?aq=.%3Aca2a18e81f674e01a71e1adb8f31a7e8&r=phd&ps=100&tab=&title=Doktoraty%2B%25E2%2580%2593%2BWewn%25C4%2585trznaczyniowe%2Bleczenie%2Bzw%25C4%2599%25C5%25BCe%25C5%2584%2Bi%2Bniedro%25C5%25BCno%25C5%259Bci%2B%25C5%25BCy%25C5%2582%2Bcentralnych%2Bw%2Bklatce%2Bpiersiowej%2Bz%2Bzastosowaniem%2Bstent%25C3%25B3w%2B%25C5%25BCylnych%2Bu%2Bpacjent%25C3%25B3w%2Bhemodializowanych%2B%25E2%2580%2593%2BPolska%2BPlatforma%2BMedyczna&lang=pl,CC BY-SA
25,Związek między agresją i autoagresją a inteligencją emocjonalną oraz polimorfizmem genów związanych z neurotransmisją dopaminergiczną u młodzieży z zaburzeniami zachowania,https://ppm.edu.pl/info/phd/UMW6785564328c8413b8699eefce0140fd4?aq=.%3Aca2a18e81f674e01a71e1adb8f31a7e8&r=phd&ps=100&tab=&title=Doktoraty%2B%25E2%2580%2593%2BZwi%25C4%2585zek%2Bmi%25C4%2599dzy%2Bagresj%25C4%2585%2Bi%2Bautoagresj%25C4%2585%2Ba%2Binteligencj%25C4%2585%2Bemocjonaln%25C4%2585%2Boraz%2Bpolimorfizmem%2Bgen%25C3%25B3w%2Bzwi%25C4%2585zanych%2Bz%2Bneurotransmisj%25C4%2585%2Bdopaminergiczn%25C4%2585%2Bu%2Bm%25C5%2582odzie%25C5%25BCy%2Bz%2Bzaburzeniami%2Bzachowania%2B%25E2%2580%2593%2BPolska%2BPlatforma%2BMedyczna&lang=pl,CC BY-SA
26,Wpływ zespołu metabolicznego i jego komponent na zmiany strukturalne i czynnościowe tętnic szyjnych - różnice płci,https://ppm.edu.pl/info/phd/UMWe21ac49ad4da4a899838ee55326d6bf9?aq=.%3Aca2a18e81f674e01a71e1adb8f31a7e8&r=phd&ps=100&tab=&title=Doktoraty%2B%25E2%2580%2593%2BWp%25C5%2582yw%2Bzespo%25C5%2582u%2Bmetabolicznego%2Bi%2Bjego%2Bkomponent%2Bna%2Bzmiany%2Bstrukturalne%2Bi%2Bczynno%25C5%259Bciowe%2Bt%25C4%2599tnic%2Bszyjnych%2B-%2Br%25C3%25B3%25C5%25BCnice%2Bp%25C5%2582ci%2B%25E2%2580%2593%2BPolska%2BPlatforma%2BMedyczna&lang=pl,CC BY-SA
27,Korelacja czynności nerek z wybranymi parametrami morfologii i unaczynienia ocenianymi w badaniu TK jamy brzusznej,https://ppm.edu.pl/info/phd/UMW780891879f874f94b9b100c8dfb9464c?aq=.%3Aca2a18e81f674e01a71e1adb8f31a7e8&r=phd&ps=100&tab=&title=Doktoraty%2B%25E2%2580%2593%2BKorelacja%2Bczynno%25C5%259Bci%2Bnerek%2Bz%2Bwybranymi%2Bparametrami%2Bmorfologii%2Bi%2Bunaczynienia%2Bocenianymi%2Bw%2Bbadaniu%2BTK%2Bjamy%2Bbrzusznej%2B%25E2%2580%2593%2BPolska%2BPlatforma%2BMedyczna&lang=pl,CC BY-SA
28,"Biblioteka Uniwersytetu Medycznego im. Piastów Śląskich we Wrocławiu w latach 1950-2020. Dzieje, organizacja i działalność",https://ppm.edu.pl/info/phd/UMWd16067bc485a444c96b802d64dad7bde?aq=.%3Aca2a18e81f674e01a71e1adb8f31a7e8&r=phd&ps=100&tab=&title=Doktoraty%2B%25E2%2580%2593%2BBiblioteka%2BUniwersytetu%2BMedycznego%2Bim.%2BPiast%25C3%25B3w%2B%25C5%259Al%25C4%2585skich%2Bwe%2BWroc%25C5%2582awiu%2Bw%2Blatach%2B1950-2020.%2BDzieje%252C%2Borganizacja%2Bi%2Bdzia%25C5%2582alno%25C5%259B%25C4%2587%2B%25E2%2580%2593%2BPolska%2BPlatforma%2BMedyczna&lang=pl,CC BY-SA
29,Krzywa uczenia a przebieg i wyniki zabiegu przezcewnikowej naprawy zastawki mitralnej u pacjentów wysokiego ryzyka z niedomykalnością mitralną typu wtórnego,https://ppm.edu.pl/info/phd/UML47c00465c98748f7837d4c11bab5f999?aq=.%3Aca2a18e81f674e01a71e1adb8f31a7e8&r=phd&ps=100&tab=&title=Doktoraty%2B%25E2%2580%2593%2BKrzywa%2Buczenia%2Ba%2Bprzebieg%2Bi%2Bwyniki%2Bzabiegu%2Bprzezcewnikowej%2Bnaprawy%2Bzastawki%2Bmitralnej%2Bu%2Bpacjent%25C3%25B3w%2Bwysokiego%2Bryzyka%2Bz%2Bniedomykalno%25C5%259Bci%25C4%2585%2Bmitraln%25C4%2585%2Btypu%2Bwt%25C3%25B3rnego%2B%25E2%2580%2593%2BPolska%2BPlatforma%2BMedyczna&lang=pl,CC BY-SA
30,Znaczenie prognostyczne ekspresji polimerazy poli(ADP-rybozy) 1 (PARP1) u pacjentów z czerniakiem skóry,https://ppm.edu.pl/info/phd/UMWa4fcde1353d44da1bdc397cba390f957?aq=.%3Aca2a18e81f674e01a71e1adb8f31a7e8&r=phd&ps=100&tab=&title=Doktoraty%2B%25E2%2580%2593%2BZnaczenie%2Bprognostyczne%2Bekspresji%2Bpolimerazy%2Bpoli%2528ADP-rybozy%2529%2B1%2B%2528PARP1%2529%2Bu%2Bpacjent%25C3%25B3w%2Bz%2Bczerniakiem%2Bsk%25C3%25B3ry%2B%25E2%2580%2593%2BPolska%2BPlatforma%2BMedyczna&lang=pl,CC BY-SA
31,Skuteczność i bezpieczeństwo wewnątrznaczyniowego leczenia chorych z tętniakami naczyń mózgowych przy użyciu systemu przerwania przepływu WEB,https://ppm.edu.pl/info/phd/UMWf8f57db81aed48d092416c00f551b7d8?aq=.%3Aca2a18e81f674e01a71e1adb8f31a7e8&r=phd&ps=100&tab=&title=Doktoraty%2B%25E2%2580%2593%2BSkuteczno%25C5%259B%25C4%2587%2Bi%2Bbezpiecze%25C5%2584stwo%2Bwewn%25C4%2585trznaczyniowego%2Bleczenia%2Bchorych%2Bz%2Bt%25C4%2599tniakami%2Bnaczy%25C5%2584%2Bm%25C3%25B3zgowych%2Bprzy%2Bu%25C5%25BCyciu%2Bsystemu%2Bprzerwania%2Bprzep%25C5%2582ywu%2BWEB%2B%25E2%2580%2593%2BPolska%2BPlatforma%2BMedyczna&lang=pl,CC BY-SA
32,"Współistnienie objawowego i bezobjawowego zakażenia wirusem brodawczaka ludzkiego (HPV) u pacjentek z innymi zakażeniami i chorobami przenoszonymi drogą płciową (kiła, HIV, Chlamydia trachomatis, rzeżączka)",https://ppm.edu.pl/info/phd/WUMd469524fd129453ab72cf8585dba759e?aq=.%3Aca2a18e81f674e01a71e1adb8f31a7e8&r=phd&ps=100&tab=&title=Doktoraty%2B%25E2%2580%2593%2BWsp%25C3%25B3%25C5%2582istnienie%2Bobjawowego%2Bi%2Bbezobjawowego%2Bzaka%25C5%25BCenia%2Bwirusem%2Bbrodawczaka%2Bludzkiego%2B%2528HPV%2529%2Bu%2Bpacjentek%2Bz%2Binnymi%2Bzaka%25C5%25BCeniami%2Bi%2Bchorobami%2Bprzenoszonymi%2Bdrog%25C4%2585%2Bp%25C5%2582ciow%25C4%2585%2B%2528ki%25C5%2582a%252C%2BHIV%252C%2BChlamydia%2Btrachomatis%252C%2Brze%25C5%25BC%25C4%2585czka%2529%2B%25E2%2580%2593%2BPolska%2BPlatforma%2BMedyczna&lang=pl,CC BY-SA
33,Ocena skuteczności leczenia twardziny ograniczonej mezoterapią igłową i bezigłową,https://ppm.edu.pl/info/phd/UMW7b52ac6d2a8f4ad5aafdcc8efacae449?aq=.%3Aca2a18e81f674e01a71e1adb8f31a7e8&r=phd&ps=100&tab=&title=Doktoraty%2B%25E2%2580%2593%2BOcena%2Bskuteczno%25C5%259Bci%2Bleczenia%2Btwardziny%2Bograniczonej%2Bmezoterapi%25C4%2585%2Big%25C5%2582ow%25C4%2585%2Bi%2Bbezig%25C5%2582ow%25C4%2585%2B%25E2%2580%2593%2BPolska%2BPlatforma%2BMedyczna&lang=pl,CC BY-SA
34,Znaczenie wybranych wskaźników immunologicznych w ocenie ryzyka ciężkich powikłań septycznych u chorych po rozległych urazach,https://ppm.edu.pl/info/phd/WUM2dba692f6e594d04a7d189caf74b5cfe?aq=.%3Aca2a18e81f674e01a71e1adb8f31a7e8&r=phd&ps=100&tab=&title=Doktoraty%2B%25E2%2580%2593%2BZnaczenie%2Bwybranych%2Bwska%25C5%25BAnik%25C3%25B3w%2Bimmunologicznych%2Bw%2Bocenie%2Bryzyka%2Bci%25C4%2599%25C5%25BCkich%2Bpowik%25C5%2582a%25C5%2584%2Bseptycznych%2Bu%2Bchorych%2Bpo%2Brozleg%25C5%2582ych%2Burazach%2B%25E2%2580%2593%2BPolska%2BPlatforma%2BMedyczna&lang=pl,CC BY-SA
35,Wpływ masażu biurowego Reborn na stres u pracowników biurowych,https://ppm.edu.pl/info/phd/UMW408011a69c5a4a5985dbfa1242709f49?aq=.%3Aca2a18e81f674e01a71e1adb8f31a7e8&r=phd&ps=100&tab=&title=Doktoraty%2B%25E2%2580%2593%2BWp%25C5%2582yw%2Bmasa%25C5%25BCu%2Bbiurowego%2BReborn%2Bna%2Bstres%2Bu%2Bpracownik%25C3%25B3w%2Bbiurowych%2B%25E2%2580%2593%2BPolska%2BPlatforma%2BMedyczna&lang=pl,CC BY-SA
36,Żywność dla niemowląt i małych dzieci w odniesieniu do aktualnych standardów medycznych,https://ppm.edu.pl/info/phd/WUMe6eb9f9a3bb64a779e3e48eab1677a2a?aq=.%3Aca2a18e81f674e01a71e1adb8f31a7e8&r=phd&ps=100&tab=&title=Doktoraty%2B%25E2%2580%2593%2B%25C5%25BBywno%25C5%259B%25C4%2587%2Bdla%2Bniemowl%25C4%2585t%2Bi%2Bma%25C5%2582ych%2Bdzieci%2Bw%2Bodniesieniu%2Bdo%2Baktualnych%2Bstandard%25C3%25B3w%2Bmedycznych%2B%2B%25E2%2580%2593%2BPolska%2BPlatforma%2BMedyczna&lang=pl,CC BY-SA
37,Udział syntaz tlenku azotu w działaniu analgetycznym tapentadolu,https://ppm.edu.pl/info/phd/WUM82435eb967c3458e876059e660690b94?aq=.%3Aca2a18e81f674e01a71e1adb8f31a7e8&r=phd&ps=100&tab=&title=Doktoraty%2B%25E2%2580%2593%2BUdzia%25C5%2582%2Bsyntaz%2Btlenku%2Bazotu%2Bw%2Bdzia%25C5%2582aniu%2Banalgetycznym%2Btapentadolu%2B%25E2%2580%2593%2BPolska%2BPlatforma%2BMedyczna&lang=pl,CC BY-SA
38,Mezenchymalne komórki macierzyste popłodu człowieka jako źródło materiału do terapii komórkowej,https://ppm.edu.pl/info/phd/WUM905d00d9fce5408699cd4f9e23949222?aq=.%3Aca2a18e81f674e01a71e1adb8f31a7e8&r=phd&ps=100&tab=&title=Doktoraty%2B%25E2%2580%2593%2BMezenchymalne%2Bkom%25C3%25B3rki%2Bmacierzyste%2Bpop%25C5%2582odu%2Bcz%25C5%2582owieka%2Bjako%2B%25C5%25BAr%25C3%25B3d%25C5%2582o%2Bmateria%25C5%2582u%2Bdo%2Bterapii%2Bkom%25C3%25B3rkowej%2B%25E2%2580%2593%2BPolska%2BPlatforma%2BMedyczna&lang=pl,CC BY-SA
39,Oporność na karbapenemy szczepów z rodzaju Acinetobacter i Pseudomonas oraz opracowanie metody szybkiej detekcji wybranych karbapenemaz,https://ppm.edu.pl/info/phd/WUMc334ca7ec3a24f1086c9f3bd51be23ef?aq=.%3Aca2a18e81f674e01a71e1adb8f31a7e8&r=phd&ps=100&tab=&title=Doktoraty%2B%25E2%2580%2593%2BOporno%25C5%259B%25C4%2587%2Bna%2Bkarbapenemy%2Bszczep%25C3%25B3w%2Bz%2Brodzaju%2BAcinetobacter%2Bi%2BPseudomonas%2Boraz%2Bopracowanie%2Bmetody%2Bszybkiej%2Bdetekcji%2Bwybranych%2Bkarbapenemaz%2B%25E2%2580%2593%2BPolska%2BPlatforma%2BMedyczna&lang=pl,CC BY-SA
40,Analiza profilu metabolicznego pacjentów z przewlekłą niewydolnością serca i współistniejącym migotaniem przedsionków,https://ppm.edu.pl/info/phd/WUMf91710e9c90f477295eeec78a10c27a5?aq=.%3Aca2a18e81f674e01a71e1adb8f31a7e8&r=phd&ps=100&tab=&title=Doktoraty%2B%25E2%2580%2593%2BAnaliza%2Bprofilu%2Bmetabolicznego%2Bpacjent%25C3%25B3w%2Bz%2Bprzewlek%25C5%2582%25C4%2585%2Bniewydolno%25C5%259Bci%25C4%2585%2Bserca%2Bi%2Bwsp%25C3%25B3%25C5%2582istniej%25C4%2585cym%2Bmigotaniem%2Bprzedsionk%25C3%25B3w%2B%25E2%2580%2593%2BPolska%2BPlatforma%2BMedyczna&lang=pl,CC BY-SA
41,Skuteczność nowych leków przeciwpadaczkowych w pilokarpinowym modelu drgawek u myszy,https://ppm.edu.pl/info/phd/UML6be3aa77bb7741d3b660ec27e2a9dfcb?aq=.%3Aca2a18e81f674e01a71e1adb8f31a7e8&r=phd&ps=100&tab=&title=Doktoraty%2B%25E2%2580%2593%2BSkuteczno%25C5%259B%25C4%2587%2Bnowych%2Blek%25C3%25B3w%2Bprzeciwpadaczkowych%2Bw%2Bpilokarpinowym%2Bmodelu%2Bdrgawek%2Bu%2Bmyszy%2B%25E2%2580%2593%2BPolska%2BPlatforma%2BMedyczna&lang=pl,CC BY-SA
42,Poszukiwanie optymalnego stężenia tlenu stosowanego podczas resuscytacji noworodków urodzonych przed 32 tygodniem ciąży- badanie z randomizacją,https://ppm.edu.pl/info/phd/WUMc3aa27e447b04f90bef5a2b154146fa5?aq=.%3Aca2a18e81f674e01a71e1adb8f31a7e8&r=phd&ps=100&tab=&title=Doktoraty%2B%25E2%2580%2593%2BPoszukiwanie%2Boptymalnego%2Bst%25C4%2599%25C5%25BCenia%2Btlenu%2Bstosowanego%2Bpodczas%2Bresuscytacji%2Bnoworodk%25C3%25B3w%2Burodzonych%2Bprzed%2B32%2Btygodniem%2Bci%25C4%2585%25C5%25BCy-%2Bbadanie%2Bz%2Brandomizacj%25C4%2585%2B%25E2%2580%2593%2BPolska%2BPlatforma%2BMedyczna&lang=pl,CC BY-SA
43,Ocena kliniczna i laboratoryjna infiltracji żywicą metakrylanową plam próchnicowych na powierzchniach gładkich zębów mlecznych,https://ppm.edu.pl/info/phd/WUM0d25276597254dd3af41ad0d4314ec0b?aq=.%3Aca2a18e81f674e01a71e1adb8f31a7e8&r=phd&ps=100&tab=&title=Doktoraty%2B%25E2%2580%2593%2BOcena%2Bkliniczna%2Bi%2Blaboratoryjna%2Binfiltracji%2B%25C5%25BCywic%25C4%2585%2Bmetakrylanow%25C4%2585%2Bplam%2Bpr%25C3%25B3chnicowych%2Bna%2Bpowierzchniach%2Bg%25C5%2582adkich%2Bz%25C4%2599b%25C3%25B3w%2Bmlecznych%2B%2B%25E2%2580%2593%2BPolska%2BPlatforma%2BMedyczna&lang=pl,CC BY-SA
44,"Nieinwazyjna ocena stanu zapalnego w drogach oddechowych u dzieci chorych na alergiczny nieżyt nosa i astmę, po ekspozycji naturalnej na pyłki traw i po swoistych testach prowokacyjnych",https://ppm.edu.pl/info/phd/WUM31e37cf243b14aa2851d383b77cc7d2f?aq=.%3Aca2a18e81f674e01a71e1adb8f31a7e8&r=phd&ps=100&tab=&title=Doktoraty%2B%25E2%2580%2593%2BNieinwazyjna%2Bocena%2Bstanu%2Bzapalnego%2Bw%2Bdrogach%2Boddechowych%2Bu%2Bdzieci%2Bchorych%2Bna%2Balergiczny%2Bnie%25C5%25BCyt%2Bnosa%2Bi%2Bastm%25C4%2599%252C%2Bpo%2Bekspozycji%2Bnaturalnej%2Bna%2Bpy%25C5%2582ki%2Btraw%2Bi%2Bpo%2Bswoistych%2Btestach%2Bprowokacyjnych%2B%25E2%2580%2593%2BPolska%2BPlatforma%2BMedyczna&lang=pl,CC BY-SA
