ID,Title,URL,License
425,Znaczenie zabiegu selektywnej histerosalpingografii u kobiet z obustronną niedrożnością jajowodów w oparciu o wyniki badań ankietowych,https://ppm.edu.pl/info/phd/UML6be07b288b7740c19ddd0ac0900fe2ff?aq=.%3Ab10aa19e712b47a39463f17f3401e58a&r=phd&ps=100&tab=&title=Doktoraty%2B%25E2%2580%2593%2BZnaczenie%2Bzabiegu%2Bselektywnej%2Bhisterosalpingografii%2Bu%2Bkobiet%2Bz%2Bobustronn%25C4%2585%2Bniedro%25C5%25BCno%25C5%259Bci%25C4%2585%2Bjajowod%25C3%25B3w%2Bw%2Boparciu%2Bo%2Bwyniki%2Bbada%25C5%2584%2Bankietowych%2B%25E2%2580%2593%2BPolska%2BPlatforma%2BMedyczna&lang=pl,CC BY
426,Wpływ płytek krwi i mikrocząsteczek pochodzenia płytkowego na uszkodzenie kardiomiocytów w warunkach chemicznego niedokrwienia i reperfuzji,https://ppm.edu.pl/info/phd/UMW99a1f46716be4d0388224414f2a87521?aq=.%3Ab10aa19e712b47a39463f17f3401e58a&r=phd&ps=100&tab=&title=Doktoraty%2B%25E2%2580%2593%2BWp%25C5%2582yw%2Bp%25C5%2582ytek%2Bkrwi%2Bi%2Bmikrocz%25C4%2585steczek%2Bpochodzenia%2Bp%25C5%2582ytkowego%2Bna%2Buszkodzenie%2Bkardiomiocyt%25C3%25B3w%2Bw%2Bwarunkach%2Bchemicznego%2Bniedokrwienia%2Bi%2Breperfuzji%2B%25E2%2580%2593%2BPolska%2BPlatforma%2BMedyczna&lang=pl,CC BY
427,Analiza czynników resekcyjności raka pola trzustkowo-dwunastniczego w materiale własnym,https://ppm.edu.pl/info/phd/UMWaa49100222f147308cf209aadebb3bab?aq=.%3Ab10aa19e712b47a39463f17f3401e58a&r=phd&ps=100&tab=&title=Doktoraty%2B%25E2%2580%2593%2BAnaliza%2Bczynnik%25C3%25B3w%2Bresekcyjno%25C5%259Bci%2Braka%2Bpola%2Btrzustkowo-dwunastniczego%2Bw%2Bmateriale%2Bw%25C5%2582asnym%2B%25E2%2580%2593%2BPolska%2BPlatforma%2BMedyczna&lang=pl,CC BY
428,Aspekty kliniczne i immunologiczne chorych z hidradenitis suppurativa,https://ppm.edu.pl/info/phd/UMWbab5858906794334a86fd4c954c527a9?aq=.%3Ab10aa19e712b47a39463f17f3401e58a&r=phd&ps=100&tab=&title=Doktoraty%2B%25E2%2580%2593%2BAspekty%2Bkliniczne%2Bi%2Bimmunologiczne%2Bchorych%2Bz%2Bhidradenitis%2Bsuppurativa%2B%25E2%2580%2593%2BPolska%2BPlatforma%2BMedyczna&lang=pl,CC BY
429,Ocena wartości klinicznej limfoangioinwazji w raku gruczołu krokowego u chorych poddanych radykalnej prostatektomii,https://ppm.edu.pl/info/phd/UMWd8c25aa5b5844891abee5b50f407598e?aq=.%3Ab10aa19e712b47a39463f17f3401e58a&r=phd&ps=100&tab=&title=Doktoraty%2B%25E2%2580%2593%2BOcena%2Bwarto%25C5%259Bci%2Bklinicznej%2Blimfoangioinwazji%2Bw%2Braku%2Bgruczo%25C5%2582u%2Bkrokowego%2Bu%2Bchorych%2Bpoddanych%2Bradykalnej%2Bprostatektomii%2B%25E2%2580%2593%2BPolska%2BPlatforma%2BMedyczna&lang=pl,CC BY
430,Humoralne mechanizmy w doświadczalnym modelu tachyarytmicznego wstrząsu kardiogennego,https://ppm.edu.pl/info/phd/UMW900344de6b28457baf6ddb52f052428a?aq=.%3Ab10aa19e712b47a39463f17f3401e58a&r=phd&ps=100&tab=&title=Doktoraty%2B%25E2%2580%2593%2BHumoralne%2Bmechanizmy%2Bw%2Bdo%25C5%259Bwiadczalnym%2Bmodelu%2Btachyarytmicznego%2Bwstrz%25C4%2585su%2Bkardiogennego%2B%25E2%2580%2593%2BPolska%2BPlatforma%2BMedyczna&lang=pl,CC BY
431,"Metody biochemiczne, histologiczne i obrazowanie radiologiczne w ocenie stanu zdrowia populacji historycznych Dolnego Śląska",https://ppm.edu.pl/info/phd/UMWf0ca486cdbb148609158971630b9ccde?aq=.%3Ab10aa19e712b47a39463f17f3401e58a&r=phd&ps=100&tab=&title=Doktoraty%2B%25E2%2580%2593%2BMetody%2Bbiochemiczne%252C%2Bhistologiczne%2Bi%2Bobrazowanie%2Bradiologiczne%2Bw%2Bocenie%2Bstanu%2Bzdrowia%2Bpopulacji%2Bhistorycznych%2BDolnego%2B%25C5%259Al%25C4%2585ska%2B%25E2%2580%2593%2BPolska%2BPlatforma%2BMedyczna&lang=pl,CC BY
432,Identyfikacja celów molekularnych imperatoryny w centralnym układzie nerwowym,https://ppm.edu.pl/info/phd/UMLe8d48642cc7947769fcb5c7bdb8d6e1b?aq=.%3Ab10aa19e712b47a39463f17f3401e58a&r=phd&ps=100&tab=&title=Doktoraty%2B%25E2%2580%2593%2BIdentyfikacja%2Bcel%25C3%25B3w%2Bmolekularnych%2Bimperatoryny%2Bw%2Bcentralnym%2Buk%25C5%2582adzie%2Bnerwowym%2B%25E2%2580%2593%2BPolska%2BPlatforma%2BMedyczna&lang=pl,CC BY
433,Diagnostyczna i rokownicza wartość nowych biomarkerów w nefropatii IgA,https://ppm.edu.pl/info/phd/UMW35161b009a9746af8d57fbb52178ff68?aq=.%3Ab10aa19e712b47a39463f17f3401e58a&r=phd&ps=100&tab=&title=Doktoraty%2B%25E2%2580%2593%2BDiagnostyczna%2Bi%2Brokownicza%2Bwarto%25C5%259B%25C4%2587%2Bnowych%2Bbiomarker%25C3%25B3w%2Bw%2Bnefropatii%2BIgA%2B%25E2%2580%2593%2BPolska%2BPlatforma%2BMedyczna&lang=pl,CC BY
434,Analiza czynników wpływających na zdolności poznawcze u pacjentów przewlekle hemodializowanych z uwzględnieniem utlenowania płatów czołowych oraz sztywności naczyń krwionośnych,https://ppm.edu.pl/info/phd/UMW2f8cc8ed969d4645af787f98df6e8ce8?aq=.%3Ab10aa19e712b47a39463f17f3401e58a&r=phd&ps=100&tab=&title=Doktoraty%2B%25E2%2580%2593%2BAnaliza%2Bczynnik%25C3%25B3w%2Bwp%25C5%2582ywaj%25C4%2585cych%2Bna%2Bzdolno%25C5%259Bci%2Bpoznawcze%2Bu%2Bpacjent%25C3%25B3w%2Bprzewlekle%2Bhemodializowanych%2Bz%2Buwzgl%25C4%2599dnieniem%2Butlenowania%2Bp%25C5%2582at%25C3%25B3w%2Bczo%25C5%2582owych%2Boraz%2Bsztywno%25C5%259Bci%2Bnaczy%25C5%2584%2Bkrwiono%25C5%259Bnych%2B%25E2%2580%2593%2BPolska%2BPlatforma%2BMedyczna&lang=pl,CC BY
435,Rola ekspresji testyny w niedrobnokomórkowych rakach płuc,https://ppm.edu.pl/info/phd/UMW6d0fc14e61a84644a88d1dba86397f5e?aq=.%3Ab10aa19e712b47a39463f17f3401e58a&r=phd&ps=100&tab=&title=Doktoraty%2B%25E2%2580%2593%2BRola%2Bekspresji%2Btestyny%2Bw%2Bniedrobnokom%25C3%25B3rkowych%2Brakach%2Bp%25C5%2582uc%2B%25E2%2580%2593%2BPolska%2BPlatforma%2BMedyczna&lang=pl,CC BY
436,Zdrowie psychiczne i strategie radzenia sobie pacjentów chorujących przewlekle podczas pandemii COVID-19 w Polsce,https://ppm.edu.pl/info/phd/UMW09611c7df791421493d5de706e49e1d5?aq=.%3Ab10aa19e712b47a39463f17f3401e58a&r=phd&ps=100&tab=&title=Doktoraty%2B%25E2%2580%2593%2BZdrowie%2Bpsychiczne%2Bi%2Bstrategie%2Bradzenia%2Bsobie%2Bpacjent%25C3%25B3w%2Bchoruj%25C4%2585cych%2Bprzewlekle%2Bpodczas%2Bpandemii%2BCOVID-19%2Bw%2BPolsce%2B%25E2%2580%2593%2BPolska%2BPlatforma%2BMedyczna&lang=pl,CC BY
437,Ocena występowania autoprzeciwciał oraz swoistych przeciwciał klasy IgE u pacjentów z pierwotnymi niedoborami odporności,https://ppm.edu.pl/info/phd/UMW22803b71c39442788e8f664215e9f02c?aq=.%3Ab10aa19e712b47a39463f17f3401e58a&r=phd&ps=100&tab=&title=Doktoraty%2B%25E2%2580%2593%2BOcena%2Bwyst%25C4%2599powania%2Bautoprzeciwcia%25C5%2582%2Boraz%2Bswoistych%2Bprzeciwcia%25C5%2582%2Bklasy%2BIgE%2Bu%2Bpacjent%25C3%25B3w%2Bz%2Bpierwotnymi%2Bniedoborami%2Bodporno%25C5%259Bci%2B%25E2%2580%2593%2BPolska%2BPlatforma%2BMedyczna&lang=pl,CC BY
438,Poziom fluoru w ślinie po aplikacji lakieru fluorkowego - badanie in vivo i in vitro,https://ppm.edu.pl/info/phd/UMW9f6ffaecff3b4aa6a7a5eb0dc542ebaf?aq=.%3Ab10aa19e712b47a39463f17f3401e58a&r=phd&ps=100&tab=&title=Doktoraty%2B%25E2%2580%2593%2BPoziom%2Bfluoru%2Bw%2B%25C5%259Blinie%2Bpo%2Baplikacji%2Blakieru%2Bfluorkowego%2B-%2Bbadanie%2Bin%2Bvivo%2Bi%2Bin%2Bvitro%2B%25E2%2580%2593%2BPolska%2BPlatforma%2BMedyczna&lang=pl,CC BY
439,Poziom stresu i interakcja ze stomatologiem w inwazyjnej procedurze stomatologicznej,https://ppm.edu.pl/info/phd/UMWe7a86e9ef24d4c9ea3f0cc8da1722124?aq=.%3Ab10aa19e712b47a39463f17f3401e58a&r=phd&ps=100&tab=&title=Doktoraty%2B%25E2%2580%2593%2BPoziom%2Bstresu%2Bi%2Binterakcja%2Bze%2Bstomatologiem%2Bw%2Binwazyjnej%2Bprocedurze%2Bstomatologicznej%2B%25E2%2580%2593%2BPolska%2BPlatforma%2BMedyczna&lang=pl,CC BY
440,Ekspresja testyny oraz markerów przejścia epitelialno-mezenchymalnego w rakach szyjki macicy oraz zmianach przedinwazyjnych,https://ppm.edu.pl/info/phd/UMW7bd57883d8894d47b52ee7b3ed530362?aq=.%3Ab10aa19e712b47a39463f17f3401e58a&r=phd&ps=100&tab=&title=Doktoraty%2B%25E2%2580%2593%2BEkspresja%2Btestyny%2Boraz%2Bmarker%25C3%25B3w%2Bprzej%25C5%259Bcia%2Bepitelialno-mezenchymalnego%2Bw%2Brakach%2Bszyjki%2Bmacicy%2Boraz%2Bzmianach%2Bprzedinwazyjnych%2B%25E2%2580%2593%2BPolska%2BPlatforma%2BMedyczna&lang=pl,CC BY
441,Dokładność zdjęcia pantomograficznego w zależności od sposobu rejestracji obrazu cyfrowego,https://ppm.edu.pl/info/phd/UML75228cd33ef446f3a312dc944e620db2?aq=.%3Ab10aa19e712b47a39463f17f3401e58a&r=phd&ps=100&tab=&title=Doktoraty%2B%25E2%2580%2593%2BDok%25C5%2582adno%25C5%259B%25C4%2587%2Bzdj%25C4%2599cia%2Bpantomograficznego%2Bw%2Bzale%25C5%25BCno%25C5%259Bci%2Bod%2Bsposobu%2Brejestracji%2Bobrazu%2Bcyfrowego%2B%25E2%2580%2593%2BPolska%2BPlatforma%2BMedyczna&lang=pl,CC BY
442,"Analiza mechanizmów skuteczności leczenia immunosupresyjnego u biorców przeszczepu nerki z wykorzystaniem parametrów farmakogenomicznych i farmakokinetycznych metabolizmu leków, a także oceny działań niepożądanych i jakości życia",https://ppm.edu.pl/info/phd/UMW158083660b2b4ff080cace24bf3f1d41?aq=.%3Ab10aa19e712b47a39463f17f3401e58a&r=phd&ps=100&tab=&title=Doktoraty%2B%25E2%2580%2593%2BAnaliza%2Bmechanizm%25C3%25B3w%2Bskuteczno%25C5%259Bci%2Bleczenia%2Bimmunosupresyjnego%2Bu%2Bbiorc%25C3%25B3w%2Bprzeszczepu%2Bnerki%2Bz%2Bwykorzystaniem%2Bparametr%25C3%25B3w%2Bfarmakogenomicznych%2Bi%2Bfarmakokinetycznych%2Bmetabolizmu%2Blek%25C3%25B3w%252C%2Ba%2Btak%25C5%25BCe%2Boceny%2Bdzia%25C5%2582a%25C5%2584%2Bniepo%25C5%25BC%25C4%2585danych%2Bi%2Bjako%25C5%259Bci%2B%25C5%25BCycia%2B%25E2%2580%2593%2BPolska%2BPlatforma%2BMedyczna&lang=pl,CC BY
443,Analiza poziomu winianoopornej fosfatazy kwaśnej (TRAP 5b) i osteopontyny u pacjentek ze złamaniem kości udowej,https://ppm.edu.pl/info/phd/UML0d6643332c184e4b95377de5ef646f89?aq=.%3Ab10aa19e712b47a39463f17f3401e58a&r=phd&ps=100&tab=&title=Doktoraty%2B%25E2%2580%2593%2BAnaliza%2Bpoziomu%2Bwinianoopornej%2Bfosfatazy%2Bkwa%25C5%259Bnej%2B%2528TRAP%2B5b%2529%2Bi%2Bosteopontyny%2Bu%2Bpacjentek%2Bze%2Bz%25C5%2582amaniem%2Bko%25C5%259Bci%2Budowej%2B%25E2%2580%2593%2BPolska%2BPlatforma%2BMedyczna&lang=pl,CC BY
444,"Wpływ terapii elektrowstrząsowej na czynność mięśnia sercowego – badania elektrokardiograficzne, wektorkardiograficzne i biochemiczne",https://ppm.edu.pl/info/phd/UMLa881549e2a514812b512991f8105db41?aq=.%3Ab10aa19e712b47a39463f17f3401e58a&r=phd&ps=100&tab=&title=Doktoraty%2B%25E2%2580%2593%2BWp%25C5%2582yw%2Bterapii%2Belektrowstrz%25C4%2585sowej%2Bna%2Bczynno%25C5%259B%25C4%2587%2Bmi%25C4%2599%25C5%259Bnia%2Bsercowego%2B%25E2%2580%2593%2Bbadania%2Belektrokardiograficzne%252C%2Bwektorkardiograficzne%2Bi%2Bbiochemiczne%2B%25E2%2580%2593%2BPolska%2BPlatforma%2BMedyczna&lang=pl,CC BY
445,Badanie zdolności do inkorporacji w strukturę włosów wybranych związków z grupy nowych substancji psychoaktywnych i ich metabolitów,https://ppm.edu.pl/info/phd/UMLea8e1e96386045a4acbff7c0574aa941?aq=.%3Ab10aa19e712b47a39463f17f3401e58a&r=phd&ps=100&tab=&title=Doktoraty%2B%25E2%2580%2593%2BBadanie%2Bzdolno%25C5%259Bci%2Bdo%2Binkorporacji%2Bw%2Bstruktur%25C4%2599%2Bw%25C5%2582os%25C3%25B3w%2Bwybranych%2Bzwi%25C4%2585zk%25C3%25B3w%2Bz%2Bgrupy%2Bnowych%2Bsubstancji%2Bpsychoaktywnych%2Bi%2Bich%2Bmetabolit%25C3%25B3w%2B%25E2%2580%2593%2BPolska%2BPlatforma%2BMedyczna&lang=pl,CC BY
446,Ocena powikłań pooperacyjnych i nawrotów u pacjentów leczonych w szpitalu w Trzebnicy z powodu przepukliny pachwinowej metodą beznapięciową z użyciem siatki samomocującej i wszywanej w latach 2008-2018,https://ppm.edu.pl/info/phd/UMWbb2cd54f88bc44ceb2d45a88ea26e1e9?aq=.%3Ab10aa19e712b47a39463f17f3401e58a&r=phd&ps=100&tab=&title=Doktoraty%2B%25E2%2580%2593%2BOcena%2Bpowik%25C5%2582a%25C5%2584%2Bpooperacyjnych%2Bi%2Bnawrot%25C3%25B3w%2Bu%2Bpacjent%25C3%25B3w%2Bleczonych%2Bw%2Bszpitalu%2Bw%2BTrzebnicy%2Bz%2Bpowodu%2Bprzepukliny%2Bpachwinowej%2Bmetod%25C4%2585%2Bbeznapi%25C4%2599ciow%25C4%2585%2Bz%2Bu%25C5%25BCyciem%2Bsiatki%2Bsamomocuj%25C4%2585cej%2Bi%2Bwszywanej%2Bw%2Blatach%2B2008-2018%2B%25E2%2580%2593%2BPolska%2BPlatforma%2BMedyczna&lang=pl,CC BY
447,"Oznaczenie cytokiny MIDKINE w surowicy, tkankach guza oraz węzłów chłonnych pacjentek z rakiem endometrium",https://ppm.edu.pl/info/phd/UML25f07181502e407da6971b3ef71c8dd2?aq=.%3Ab10aa19e712b47a39463f17f3401e58a&r=phd&ps=100&tab=&title=Doktoraty%2B%25E2%2580%2593%2BOznaczenie%2Bcytokiny%2BMIDKINE%2Bw%2Bsurowicy%252C%2Btkankach%2Bguza%2Boraz%2Bw%25C4%2599z%25C5%2582%25C3%25B3w%2Bch%25C5%2582onnych%2Bpacjentek%2Bz%2Brakiem%2Bendometrium%2B%25E2%2580%2593%2BPolska%2BPlatforma%2BMedyczna&lang=pl,CC BY
448,Czynniki ryzyka zakrzepowo-zatorowego u chorych z rozpoznaniem migotania przedsionków w aspekcie leczenia przeciwzakrzepowego oraz rokowania odległego,https://ppm.edu.pl/info/phd/UMWf110b799b6ba40cb9078e227f5860524?aq=.%3Ab10aa19e712b47a39463f17f3401e58a&r=phd&ps=100&tab=&title=Doktoraty%2B%25E2%2580%2593%2BCzynniki%2Bryzyka%2Bzakrzepowo-zatorowego%2Bu%2Bchorych%2Bz%2Brozpoznaniem%2Bmigotania%2Bprzedsionk%25C3%25B3w%2Bw%2Baspekcie%2Bleczenia%2Bprzeciwzakrzepowego%2Boraz%2Brokowania%2Bodleg%25C5%2582ego%2B%25E2%2580%2593%2BPolska%2BPlatforma%2BMedyczna&lang=pl,CC BY
449,Analiza czynników wpływających na jakość życia pacjentów z nowotworem piersi poddawanych chemioterapii,https://ppm.edu.pl/info/phd/UMW4a13d3b5a1b541688f01bbdb045c5b34?aq=.%3Ab10aa19e712b47a39463f17f3401e58a&r=phd&ps=100&tab=&title=Doktoraty%2B%25E2%2580%2593%2BAnaliza%2Bczynnik%25C3%25B3w%2Bwp%25C5%2582ywaj%25C4%2585cych%2Bna%2Bjako%25C5%259B%25C4%2587%2B%25C5%25BCycia%2Bpacjent%25C3%25B3w%2Bz%2Bnowotworem%2Bpiersi%2Bpoddawanych%2Bchemioterapii%2B%25E2%2580%2593%2BPolska%2BPlatforma%2BMedyczna&lang=pl,CC BY
450,Ocena stopnia regeneracji zębodołów poekstrakcyjnych trzecich zębów trzonowych dolnych z zastosowaniem inżynierii tkankowej oraz fotobiomodulacji,https://ppm.edu.pl/info/phd/UMW0613c0dbe03f484daed273eda063782f?aq=.%3Ab10aa19e712b47a39463f17f3401e58a&r=phd&ps=100&tab=&title=Doktoraty%2B%25E2%2580%2593%2BOcena%2Bstopnia%2Bregeneracji%2Bz%25C4%2599bodo%25C5%2582%25C3%25B3w%2Bpoekstrakcyjnych%2Btrzecich%2Bz%25C4%2599b%25C3%25B3w%2Btrzonowych%2Bdolnych%2Bz%2Bzastosowaniem%2Bin%25C5%25BCynierii%2Btkankowej%2Boraz%2Bfotobiomodulacji%2B%25E2%2580%2593%2BPolska%2BPlatforma%2BMedyczna&lang=pl,CC BY
451,"Wykorzystanie innowacyjnych niefarmakologicznych metod stymulacji poznawczej (przezczaszkowa stymulacja mózgu, komputerowy trening poznawczy i krioterapia) w chorobach neurodegeneracyjnych mózgu",https://ppm.edu.pl/info/phd/UMW10a21e9a40d749a0b329566e232118bd?aq=.%3Ab10aa19e712b47a39463f17f3401e58a&r=phd&ps=100&tab=&title=Doktoraty%2B%25E2%2580%2593%2BWykorzystanie%2Binnowacyjnych%2Bniefarmakologicznych%2Bmetod%2Bstymulacji%2Bpoznawczej%2B%2528przezczaszkowa%2Bstymulacja%2Bm%25C3%25B3zgu%252C%2Bkomputerowy%2Btrening%2Bpoznawczy%2Bi%2Bkrioterapia%2529%2Bw%2Bchorobach%2Bneurodegeneracyjnych%2Bm%25C3%25B3zgu%2B%25E2%2580%2593%2BPolska%2BPlatforma%2BMedyczna&lang=pl,CC BY
452,Zastosowanie wirtualnej rzeczywistości w procesie stymulowania funkcji poznawczych pacjentów onkologicznych poddawanych radioterapii,https://ppm.edu.pl/info/phd/UMWc1586049b9d24d69802df197b857030d?aq=.%3Ab10aa19e712b47a39463f17f3401e58a&r=phd&ps=100&tab=&title=Doktoraty%2B%25E2%2580%2593%2BZastosowanie%2Bwirtualnej%2Brzeczywisto%25C5%259Bci%2Bw%2Bprocesie%2Bstymulowania%2Bfunkcji%2Bpoznawczych%2Bpacjent%25C3%25B3w%2Bonkologicznych%2Bpoddawanych%2Bradioterapii%2B%25E2%2580%2593%2BPolska%2BPlatforma%2BMedyczna&lang=pl,CC BY
453,Nawyki żywieniowe dotyczące spożycia roślin strączkowych w populacji polskiej oraz ich wpływ na status redoks i wskaźniki metaboliczne,https://ppm.edu.pl/info/phd/UMWc133528eaf924f7b8bdb3d9fd7cae663?aq=.%3Ab10aa19e712b47a39463f17f3401e58a&r=phd&ps=100&tab=&title=Doktoraty%2B%25E2%2580%2593%2BNawyki%2B%25C5%25BCywieniowe%2Bdotycz%25C4%2585ce%2Bspo%25C5%25BCycia%2Bro%25C5%259Blin%2Bstr%25C4%2585czkowych%2Bw%2Bpopulacji%2Bpolskiej%2Boraz%2Bich%2Bwp%25C5%2582yw%2Bna%2Bstatus%2Bredoks%2Bi%2Bwska%25C5%25BAniki%2Bmetaboliczne%2B%25E2%2580%2593%2BPolska%2BPlatforma%2BMedyczna&lang=pl,CC BY
454,Badania zmian w mózgowiu u pacjentów z pierwotnym zespołem Sjögrena za pomocą zaawansowanych technik rezonansu magnetycznego : korelacje radiologiczno-kliniczne,https://ppm.edu.pl/info/phd/UMW34350064c07c4661803d13184b454054?aq=.%3Ab10aa19e712b47a39463f17f3401e58a&r=phd&ps=100&tab=&title=Doktoraty%2B%25E2%2580%2593%2BBadania%2Bzmian%2Bw%2Bm%25C3%25B3zgowiu%2Bu%2Bpacjent%25C3%25B3w%2Bz%2Bpierwotnym%2Bzespo%25C5%2582em%2BSj%25C3%25B6grena%2Bza%2Bpomoc%25C4%2585%2Bzaawansowanych%2Btechnik%2Brezonansu%2Bmagnetycznego%2B%253A%2Bkorelacje%2Bradiologiczno-kliniczne%2B%25E2%2580%2593%2BPolska%2BPlatforma%2BMedyczna&lang=pl,CC BY
455,"Synteza nowych pochodnych 5-aminooksazolo-4-karbonitrylu i oksazolo[5,4-d]pirymidyny o potencjalnej aktywności biologicznej",https://ppm.edu.pl/info/phd/UMW08e3c47e57b945979d34a3dfa24172e8?aq=.%3Ab10aa19e712b47a39463f17f3401e58a&r=phd&ps=100&tab=&title=Doktoraty%2B%25E2%2580%2593%2BSynteza%2Bnowych%2Bpochodnych%2B5-aminooksazolo-4-karbonitrylu%2Bi%2Boksazolo%255B5%252C4-d%255Dpirymidyny%2Bo%2Bpotencjalnej%2Baktywno%25C5%259Bci%2Bbiologicznej%2B%25E2%2580%2593%2BPolska%2BPlatforma%2BMedyczna&lang=pl,CC BY
456,Sztywność tętnic u chorych z przewlekłym zespołem wieńcowym,https://ppm.edu.pl/info/phd/UMWea570809646042bb96972f5adfb1abbe?aq=.%3Ab10aa19e712b47a39463f17f3401e58a&r=phd&ps=100&tab=&title=Doktoraty%2B%25E2%2580%2593%2BSztywno%25C5%259B%25C4%2587%2Bt%25C4%2599tnic%2Bu%2Bchorych%2Bz%2Bprzewlek%25C5%2582ym%2Bzespo%25C5%2582em%2Bwie%25C5%2584cowym%2B%25E2%2580%2593%2BPolska%2BPlatforma%2BMedyczna&lang=pl,CC BY
457,Analiza okluzji przed i po leczeniu operacyjnym pacjentów z wadami klasy trzeciej wg Angle'a,https://ppm.edu.pl/info/phd/UMW559b2eabd57d4650bb1f1e768cd5a400?aq=.%3Ab10aa19e712b47a39463f17f3401e58a&r=phd&ps=100&tab=&title=Doktoraty%2B%25E2%2580%2593%2BAnaliza%2Bokluzji%2Bprzed%2Bi%2Bpo%2Bleczeniu%2Boperacyjnym%2Bpacjent%25C3%25B3w%2Bz%2Bwadami%2Bklasy%2Btrzeciej%2Bwg%2BAngle%2527a%2B%25E2%2580%2593%2BPolska%2BPlatforma%2BMedyczna&lang=pl,CC BY
458,Porównanie anatomii usuniętych zębów stałych. Ocena opracowania kanałów korzeniowych i kwalifikacja pod zaopatrzenie wybranych zębów wkładami koronowo-korzeniowymi,https://ppm.edu.pl/info/phd/UMLa54c7569c0cb495e98f6fb9455c83dcd?aq=.%3Ab10aa19e712b47a39463f17f3401e58a&r=phd&ps=100&tab=&title=Doktoraty%2B%25E2%2580%2593%2BPor%25C3%25B3wnanie%2Banatomii%2Busuni%25C4%2599tych%2Bz%25C4%2599b%25C3%25B3w%2Bsta%25C5%2582ych.%2BOcena%2Bopracowania%2Bkana%25C5%2582%25C3%25B3w%2Bkorzeniowych%2Bi%2Bkwalifikacja%2Bpod%2Bzaopatrzenie%2Bwybranych%2Bz%25C4%2599b%25C3%25B3w%2Bwk%25C5%2582adami%2Bkoronowo-korzeniowymi%2B%25E2%2580%2593%2BPolska%2BPlatforma%2BMedyczna&lang=pl,CC BY
459,"Bariery i czynniki ułatwiające wdrażanie innowacyjnych interwencji w zakresie e-zdrowia na poziomie mikro-, mezo- i makroregionalnym w ramach polskiego systemu opieki zdrowotnej i społecznej",https://ppm.edu.pl/info/phd/UMW3e6d5ca7125443988782e7db3e1e788e?aq=.%3Ab10aa19e712b47a39463f17f3401e58a&r=phd&ps=100&tab=&title=Doktoraty%2B%25E2%2580%2593%2BBariery%2Bi%2Bczynniki%2Bu%25C5%2582atwiaj%25C4%2585ce%2Bwdra%25C5%25BCanie%2Binnowacyjnych%2Binterwencji%2Bw%2Bzakresie%2Be-zdrowia%2Bna%2Bpoziomie%2Bmikro-%252C%2Bmezo-%2Bi%2Bmakroregionalnym%2Bw%2Bramach%2Bpolskiego%2Bsystemu%2Bopieki%2Bzdrowotnej%2Bi%2Bspo%25C5%2582ecznej%2B%25E2%2580%2593%2BPolska%2BPlatforma%2BMedyczna&lang=pl,CC BY
460,Wpływ pierwotniaków Entamoeba gingivalis na procesy biologiczne nabłonka jamy ustnej,https://ppm.edu.pl/info/phd/UML32d262b327e84d609d6e11a664652f9c?aq=.%3Ab10aa19e712b47a39463f17f3401e58a&r=phd&ps=100&tab=&title=Doktoraty%2B%25E2%2580%2593%2BWp%25C5%2582yw%2Bpierwotniak%25C3%25B3w%2BEntamoeba%2Bgingivalis%2Bna%2Bprocesy%2Bbiologiczne%2Bnab%25C5%2582onka%2Bjamy%2Bustnej%2B%25E2%2580%2593%2BPolska%2BPlatforma%2BMedyczna&lang=pl,CC BY
461,Analiza transkryptomu w komórkach raka piersi - poszukiwania markerów prognostycznych u pacjentek z różną odpowiedzią na leczenie,https://ppm.edu.pl/info/phd/UMW57dfb80566974482abe6040d8ebfb718?aq=.%3Ab10aa19e712b47a39463f17f3401e58a&r=phd&ps=100&tab=&title=Doktoraty%2B%25E2%2580%2593%2BAnaliza%2Btranskryptomu%2Bw%2Bkom%25C3%25B3rkach%2Braka%2Bpiersi%2B-%2Bposzukiwania%2Bmarker%25C3%25B3w%2Bprognostycznych%2Bu%2Bpacjentek%2Bz%2Br%25C3%25B3%25C5%25BCn%25C4%2585%2Bodpowiedzi%25C4%2585%2Bna%2Bleczenie%2B%25E2%2580%2593%2BPolska%2BPlatforma%2BMedyczna&lang=pl,CC BY
462,Ocena wybranych czynników immunosupresyjnych u pacjentek z endometriozą,https://ppm.edu.pl/info/phd/UML53a67e1530254b9a870e3450f1f30a1a?aq=.%3Ab10aa19e712b47a39463f17f3401e58a&r=phd&ps=100&tab=&title=Doktoraty%2B%25E2%2580%2593%2BOcena%2Bwybranych%2Bczynnik%25C3%25B3w%2Bimmunosupresyjnych%2Bu%2Bpacjentek%2Bz%2Bendometrioz%25C4%2585%2B%2B%25E2%2580%2593%2BPolska%2BPlatforma%2BMedyczna&lang=pl,CC BY
463,Poziom lęku oraz natężenie bólu podczas zabiegów otolaryngologicznych wykonywanych w znieczuleniu miejscowym,https://ppm.edu.pl/info/phd/UMWd9213e5f748a40178469d6029b3de9ef?aq=.%3Ab10aa19e712b47a39463f17f3401e58a&r=phd&ps=100&tab=&title=Doktoraty%2B%25E2%2580%2593%2BPoziom%2Bl%25C4%2599ku%2Boraz%2Bnat%25C4%2599%25C5%25BCenie%2Bb%25C3%25B3lu%2Bpodczas%2Bzabieg%25C3%25B3w%2Botolaryngologicznych%2Bwykonywanych%2Bw%2Bznieczuleniu%2Bmiejscowym%2B%25E2%2580%2593%2BPolska%2BPlatforma%2BMedyczna&lang=pl,CC BY
464,Wpływ pandemii COVID-19 na występowanie zaburzeń depresyjnych i seksualnych u kobiet i mężczyzn,https://ppm.edu.pl/info/phd/UMW0bbbe4a29d6b4a7d9f0fade9ba45c6cf?aq=.%3Ab10aa19e712b47a39463f17f3401e58a&r=phd&ps=100&tab=&title=Doktoraty%2B%25E2%2580%2593%2BWp%25C5%2582yw%2Bpandemii%2BCOVID-19%2Bna%2Bwyst%25C4%2599powanie%2Bzaburze%25C5%2584%2Bdepresyjnych%2Bi%2Bseksualnych%2Bu%2Bkobiet%2Bi%2Bm%25C4%2599%25C5%25BCczyzn%2B%25E2%2580%2593%2BPolska%2BPlatforma%2BMedyczna&lang=pl,CC BY
465,Ocena wartości wskaźnika potencjału zapalnego diet DII (ang. dietary inflammatory index) oraz jego związku z wybranymi parametrami antropometrycznymi oraz biochemicznymi czynnikami ryzyka wystąpienia chorób sercowo-naczyniowych w grupie mieszkańców województwa dolnośląskiego,https://ppm.edu.pl/info/phd/UMW672cc3d6e0734038852eebd6d173ab28?aq=.%3Ab10aa19e712b47a39463f17f3401e58a&r=phd&ps=100&tab=&title=Doktoraty%2B%25E2%2580%2593%2BOcena%2Bwarto%25C5%259Bci%2Bwska%25C5%25BAnika%2Bpotencja%25C5%2582u%2Bzapalnego%2Bdiet%2BDII%2B%2528ang.%2Bdietary%2Binflammatory%2Bindex%2529%2Boraz%2Bjego%2Bzwi%25C4%2585zku%2Bz%2Bwybranymi%2Bparametrami%2Bantropometrycznymi%2Boraz%2Bbiochemicznymi%2Bczynnikami%2Bryzyka%2Bwyst%25C4%2585pienia%2Bchor%25C3%25B3b%2Bsercowo-naczyniowych%2Bw%2Bgrupie%2Bmieszka%25C5%2584c%25C3%25B3w%2Bwojew%25C3%25B3dztwa%2Bdolno%25C5%259Bl%25C4%2585skiego%2B%25E2%2580%2593%2BPolska%2BPlatforma%2BMedyczna&lang=pl,CC BY
466,Czynniki wpływające na racjonowanie opieki w Oddziale Intensywnej Terapii Noworodka (OITN),https://ppm.edu.pl/info/phd/UMWc52483e72f8242b68fe6dacf3150ca56?aq=.%3Ab10aa19e712b47a39463f17f3401e58a&r=phd&ps=100&tab=&title=Doktoraty%2B%25E2%2580%2593%2BCzynniki%2Bwp%25C5%2582ywaj%25C4%2585ce%2Bna%2Bracjonowanie%2Bopieki%2Bw%2BOddziale%2BIntensywnej%2BTerapii%2BNoworodka%2B%2528OITN%2529%2B%25E2%2580%2593%2BPolska%2BPlatforma%2BMedyczna&lang=pl,CC BY
467,Prospektywne obserwacje następstw grypy i chorób grypopodobnych w populacji zaszczepionej i nieszczepionej przeciwko grypie,https://ppm.edu.pl/info/phd/UMW70b351512d9e4af7955593896ef5d12d?aq=.%3Ab10aa19e712b47a39463f17f3401e58a&r=phd&ps=100&tab=&title=Doktoraty%2B%25E2%2580%2593%2BProspektywne%2Bobserwacje%2Bnast%25C4%2599pstw%2Bgrypy%2Bi%2Bchor%25C3%25B3b%2Bgrypopodobnych%2Bw%2Bpopulacji%2Bzaszczepionej%2Bi%2Bnieszczepionej%2Bprzeciwko%2Bgrypie%2B%25E2%2580%2593%2BPolska%2BPlatforma%2BMedyczna&lang=pl,CC BY
468,Badania nad wpływem surfaktantu na retencję i migrację substancji aktywnych biologicznie w układach wybranych technik chromatograficznych i elektromigracyjnych,https://ppm.edu.pl/info/phd/UMLf19a69c7f1614784b739dede7b1cb5b5?aq=.%3Ab10aa19e712b47a39463f17f3401e58a&r=phd&ps=100&tab=&title=Doktoraty%2B%25E2%2580%2593%2BBadania%2Bnad%2Bwp%25C5%2582ywem%2Bsurfaktantu%2Bna%2Bretencj%25C4%2599%2Bi%2Bmigracj%25C4%2599%2Bsubstancji%2Baktywnych%2Bbiologicznie%2Bw%2Buk%25C5%2582adach%2Bwybranych%2Btechnik%2Bchromatograficznych%2Bi%2Belektromigracyjnych%2B%25E2%2580%2593%2BPolska%2BPlatforma%2BMedyczna&lang=pl,CC BY
469,Ocena skuteczności interdyscyplinarnej rehabilitacji dzieci przedwcześnie urodzonych z zaburzeniami rozwoju psychoruchowego,https://ppm.edu.pl/info/phd/UMW522f98d5eb48467191bf2c63692cacb6?aq=.%3Ab10aa19e712b47a39463f17f3401e58a&r=phd&ps=100&tab=&title=Doktoraty%2B%25E2%2580%2593%2BOcena%2Bskuteczno%25C5%259Bci%2Binterdyscyplinarnej%2Brehabilitacji%2Bdzieci%2Bprzedwcze%25C5%259Bnie%2Burodzonych%2Bz%2Bzaburzeniami%2Brozwoju%2Bpsychoruchowego%2B%25E2%2580%2593%2BPolska%2BPlatforma%2BMedyczna&lang=pl,CC BY
470,Ocena ekspresji E-kadheryny i N-kadheryny w endocervium u pacjentek z rakiem trzomu macicy,https://ppm.edu.pl/info/phd/UMLdc410279190e4fda804a5e1d4807e5e1?aq=.%3Ab10aa19e712b47a39463f17f3401e58a&r=phd&ps=100&tab=&title=Doktoraty%2B%25E2%2580%2593%2BOcena%2Bekspresji%2BE-kadheryny%2Bi%2BN-kadheryny%2Bw%2Bendocervium%2Bu%2Bpacjentek%2Bz%2Brakiem%2Btrzomu%2Bmacicy%2B%25E2%2580%2593%2BPolska%2BPlatforma%2BMedyczna&lang=pl,CC BY
471,Zastosowanie metod sztucznej inteligencji w ocenie wybranych aspektów klinicznych w niewydolności serca,https://ppm.edu.pl/info/phd/UMWbd386166728d4034b374b2a602c58d85?aq=.%3Ab10aa19e712b47a39463f17f3401e58a&r=phd&ps=100&tab=&title=Doktoraty%2B%25E2%2580%2593%2BZastosowanie%2Bmetod%2Bsztucznej%2Binteligencji%2Bw%2Bocenie%2Bwybranych%2Baspekt%25C3%25B3w%2Bklinicznych%2Bw%2Bniewydolno%25C5%259Bci%2Bserca%2B%25E2%2580%2593%2BPolska%2BPlatforma%2BMedyczna&lang=pl,CC BY
